[
  {
    "id": "splinter-pistol",
    "name": "Splinter pistol",
    "type": "ranged",
    "profiles": [
      {
        "name": "Splinter pistol",
        "range": 12,
        "stats": {
          "A": 1,
          "S": 2,
          "AP": 0,
          "D": 1,
          "BS": 3
        },
        "keywords": [
          {
            "keyword_id": "anti",
            "parameters": {
              "target_keyword": "Infantry",
              "threshold": 3
            }
          },
          {
            "keyword_id": "assault"
          },
          {
            "keyword_id": "pistol"
          }
        ]
      }
    ],
    "game_version": {
      "edition": "11th",
      "dataslate": "pre-launch-provisional"
    }
  },
  {
    "id": "splinter-rifle",
    "name": "Splinter rifle",
    "type": "ranged",
    "profiles": [
      {
        "name": "Splinter rifle",
        "range": 24,
        "stats": {
          "A": 2,
          "S": 2,
          "AP": 0,
          "D": 1,
          "BS": 3
        },
        "keywords": [
          {
            "keyword_id": "anti",
            "parameters": {
              "target_keyword": "Infantry",
              "threshold": 3
            }
          },
          {
            "keyword_id": "assault"
          }
        ]
      }
    ],
    "game_version": {
      "edition": "11th",
      "dataslate": "pre-launch-provisional"
    }
  },
  {
    "id": "blaster",
    "name": "Blaster",
    "type": "ranged",
    "profiles": [
      {
        "name": "Blaster",
        "range": 18,
        "stats": {
          "A": 1,
          "S": 8,
          "AP": -4,
          "D": "D6+1",
          "BS": 3
        },
        "keywords": [
          {
            "keyword_id": "assault"
          }
        ]
      }
    ],
    "game_version": {
      "edition": "11th",
      "dataslate": "pre-launch-provisional"
    }
  },
  {
    "id": "heat-lance",
    "name": "Heat lance",
    "type": "ranged",
    "profiles": [
      {
        "name": "Heat lance",
        "range": 18,
        "stats": {
          "A": 1,
          "S": 14,
          "AP": -4,
          "D": "D6",
          "BS": 3
        },
        "keywords": [
          {
            "keyword_id": "assault"
          },
          {
            "keyword_id": "melta",
            "parameters": {
              "value": 3
            }
          }
        ]
      }
    ],
    "game_version": {
      "edition": "11th",
      "dataslate": "pre-launch-provisional"
    }
  },
  {
    "id": "bladevanes",
    "name": "Bladevanes",
    "type": "melee",
    "profiles": [
      {
        "name": "Bladevanes",
        "range": "Melee",
        "stats": {
          "A": 4,
          "S": 4,
          "AP": -1,
          "D": 1,
          "WS": 3
        },
        "keywords": [
          {
            "keyword_id": "lance"
          }
        ]
      }
    ],
    "game_version": {
      "edition": "11th",
      "dataslate": "pre-launch-provisional"
    }
  },
  {
    "id": "spirit-syphon",
    "name": "Spirit syphon",
    "type": "ranged",
    "profiles": [
      {
        "name": "Spirit syphon",
        "range": 12,
        "stats": {
          "A": "D6",
          "S": 5,
          "AP": -1,
          "D": 1,
          "BS": null
        },
        "keywords": [
          {
            "keyword_id": "ignores-cover"
          },
          {
            "keyword_id": "torrent"
          }
        ]
      }
    ],
    "game_version": {
      "edition": "11th",
      "dataslate": "pre-launch-provisional"
    }
  },
  {
    "id": "spirit-vortex",
    "name": "Spirit vortex",
    "type": "ranged",
    "profiles": [
      {
        "name": "Spirit vortex",
        "range": 18,
        "stats": {
          "A": "D6",
          "S": 5,
          "AP": -1,
          "D": 1,
          "BS": 3
        },
        "keywords": [
          {
            "keyword_id": "blast"
          },
          {
            "keyword_id": "ignores-cover"
          }
        ]
      }
    ],
    "game_version": {
      "edition": "11th",
      "dataslate": "pre-launch-provisional"
    }
  },
  {
    "id": "spirit-leech-tentacles",
    "name": "Spirit-leech tentacles",
    "type": "melee",
    "profiles": [
      {
        "name": "Spirit-leech tentacles",
        "range": "Melee",
        "stats": {
          "A": 6,
          "S": 5,
          "AP": -1,
          "D": 1,
          "WS": 3
        },
        "keywords": [
          {
            "keyword_id": "anti",
            "parameters": {
              "target_keyword": "Infantry",
              "threshold": 2
            }
          }
        ]
      }
    ],
    "game_version": {
      "edition": "11th",
      "dataslate": "pre-launch-provisional"
    }
  },
  {
    "id": "archite-glaive-and-agoniser",
    "name": "Archite glaive and agoniser",
    "type": "melee",
    "profiles": [
      {
        "name": "Archite glaive and agoniser",
        "range": "Melee",
        "stats": {
          "A": 7,
          "S": 3,
          "AP": -2,
          "D": 1,
          "WS": 2
        },
        "keywords": [
          {
            "keyword_id": "anti",
            "parameters": {
              "target_keyword": "Infantry",
              "threshold": 3
            }
          },
          {
            "keyword_id": "precision"
          }
        ]
      }
    ],
    "game_version": {
      "edition": "11th",
      "dataslate": "pre-launch-provisional"
    }
  },
  {
    "id": "splinter-pods",
    "name": "Splinter pods",
    "type": "ranged",
    "profiles": [
      {
        "name": "Splinter pods",
        "range": 18,
        "stats": {
          "A": 2,
          "S": 2,
          "AP": 0,
          "D": 1,
          "BS": 3
        },
        "keywords": [
          {
            "keyword_id": "anti",
            "parameters": {
              "target_keyword": "Infantry",
              "threshold": 3
            }
          },
          {
            "keyword_id": "assault"
          },
          {
            "keyword_id": "twin-linked"
          }
        ]
      }
    ],
    "game_version": {
      "edition": "11th",
      "dataslate": "pre-launch-provisional"
    }
  },
  {
    "id": "hellglaive",
    "name": "Hellglaive",
    "type": "melee",
    "profiles": [
      {
        "name": "Hellglaive",
        "range": "Melee",
        "stats": {
          "A": 3,
          "S": 4,
          "AP": -1,
          "D": 2,
          "WS": 3
        },
        "keywords": [
          {
            "keyword_id": "lance"
          },
          {
            "keyword_id": "sustained-hits",
            "parameters": {
              "value": 1
            }
          }
        ]
      }
    ],
    "game_version": {
      "edition": "11th",
      "dataslate": "pre-launch-provisional"
    }
  },
  {
    "id": "stunclaw",
    "name": "Stunclaw",
    "type": "melee",
    "profiles": [
      {
        "name": "Stunclaw",
        "range": "Melee",
        "stats": {
          "A": 4,
          "S": 3,
          "AP": -1,
          "D": 1,
          "WS": 3
        },
        "keywords": [
          {
            "keyword_id": "devastating-wounds"
          },
          {
            "keyword_id": "lance"
          },
          {
            "keyword_id": "precision"
          }
        ]
      }
    ],
    "game_version": {
      "edition": "11th",
      "dataslate": "pre-launch-provisional"
    }
  },
  {
    "id": "power-weapon",
    "name": "Power weapon",
    "type": "melee",
    "profiles": [
      {
        "name": "Power weapon",
        "range": "Melee",
        "stats": {
          "A": 4,
          "S": 3,
          "AP": -2,
          "D": 1,
          "WS": 3
        },
        "keywords": [
          {
            "keyword_id": "anti",
            "parameters": {
              "target_keyword": "Infantry",
              "threshold": 3
            }
          },
          {
            "keyword_id": "lance"
          },
          {
            "keyword_id": "sustained-hits",
            "parameters": {
              "value": 1
            }
          }
        ]
      }
    ],
    "game_version": {
      "edition": "11th",
      "dataslate": "pre-launch-provisional"
    }
  },
  {
    "id": "splinter-cannon",
    "name": "Splinter cannon",
    "type": "ranged",
    "profiles": [
      {
        "name": "Splinter cannon",
        "range": 36,
        "stats": {
          "A": 3,
          "S": 3,
          "AP": -1,
          "D": 2,
          "BS": 3
        },
        "keywords": [
          {
            "keyword_id": "anti",
            "parameters": {
              "target_keyword": "Infantry",
              "threshold": 3
            }
          },
          {
            "keyword_id": "sustained-hits",
            "parameters": {
              "value": 1
            }
          }
        ]
      }
    ],
    "game_version": {
      "edition": "11th",
      "dataslate": "pre-launch-provisional"
    }
  },
  {
    "id": "twin-splinter-rifle",
    "name": "Twin splinter rifle",
    "type": "ranged",
    "profiles": [
      {
        "name": "Twin splinter rifle",
        "range": 24,
        "stats": {
          "A": 2,
          "S": 2,
          "AP": 0,
          "D": 1,
          "BS": 3
        },
        "keywords": [
          {
            "keyword_id": "anti",
            "parameters": {
              "target_keyword": "Infantry",
              "threshold": 3
            }
          },
          {
            "keyword_id": "assault"
          },
          {
            "keyword_id": "rapid-fire",
            "parameters": {
              "value": 2
            }
          },
          {
            "keyword_id": "twin-linked"
          }
        ]
      }
    ],
    "game_version": {
      "edition": "11th",
      "dataslate": "pre-launch-provisional"
    }
  },
  {
    "id": "shardcarbine",
    "name": "Shardcarbine",
    "type": "ranged",
    "profiles": [
      {
        "name": "Shardcarbine",